{
  "template": "graphite-blueprint",
  "version": "1.2.0-rc.1",
  "iteration": 1,
  "evaluatedAt": "2026-10-18T23:30:27.359Z",
  "runs": [
    {
      "runId": "20261018-231142",
      "app": "blog",
      "gates": [
        {
          "name": "agent-finished",
          "pass": true,
          "value": 0,
          "threshold": 0
        },
        {
          "name": "build",
          "pass": true,
          "value": true
        },
        {
          "name": "no-console-errors",
          "pass": true,
          "value": 0,
          "threshold": 0
        },
        {
          "name": "no-horizontal-scroll",
          "pass": true,
          "value": 0,
          "threshold": 0
        },
        {
          "name": "accessibility",
          "pass": true,
          "value": 0,
          "threshold": 0
        },
        {
          "name": "reduced-motion",
          "pass": true,
          "value": 0,
          "threshold": 0
        },
        {
          "name": "color-adherence",
          "pass": true,
          "value": 1,
          "threshold": 0.9
        },
        {
          "name": "font-adherence",
          "pass": true,
          "value": 1,
          "threshold": 0.98
        },
        {
          "name": "radius-adherence",
          "pass": true,
          "value": 1,
          "threshold": 0.85
        }
      ],
      "metrics": {
        "animations": 0,
        "loopingAnimations": 0,
        "svgAnimations": 0,
        "illustrations": 7,
        "lineDrawings": 5,
        "colorAdherence": 1,
        "fontAdherence": 1,
        "radiusAdherence": 1,
        "spacingOnScale": 0.988
      }
    },
    {
      "runId": "20261018-231142",
      "app": "commerce",
      "gates": [
        {
          "name": "agent-finished",
          "pass": true,
          "value": 0,
          "threshold": 0
        },
        {
          "name": "build",
          "pass": true,
          "value": true
        },
        {
          "name": "no-console-errors",
          "pass": true,
          "value": 0,
          "threshold": 0
        },
        {
          "name": "no-horizontal-scroll",
          "pass": true,
          "value": 0,
          "threshold": 0
        },
        {
          "name": "accessibility",
          "pass": true,
          "value": 0,
          "threshold": 0
        },
        {
          "name": "reduced-motion",
          "pass": true,
          "value": 0,
          "threshold": 0
        },
        {
          "name": "color-adherence",
          "pass": true,
          "value": 1,
          "threshold": 0.9
        },
        {
          "name": "font-adherence",
          "pass": true,
          "value": 1,
          "threshold": 0.98
        },
        {
          "name": "radius-adherence",
          "pass": true,
          "value": 1,
          "threshold": 0.85
        }
      ],
      "metrics": {
        "animations": 0,
        "loopingAnimations": 0,
        "svgAnimations": 0,
        "illustrations": 11,
        "lineDrawings": 8,
        "colorAdherence": 1,
        "fontAdherence": 1,
        "radiusAdherence": 1,
        "spacingOnScale": 0.992,
        "layout:repeated-drawing": 2
      }
    },
    {
      "runId": "20261018-231142",
      "app": "dashboard",
      "gates": [
        {
          "name": "agent-finished",
          "pass": true,
          "value": 0,
          "threshold": 0
        },
        {
          "name": "build",
          "pass": true,
          "value": true
        },
        {
          "name": "no-console-errors",
          "pass": true,
          "value": 0,
          "threshold": 0
        },
        {
          "name": "no-horizontal-scroll",
          "pass": true,
          "value": 0,
          "threshold": 0
        },
        {
          "name": "accessibility",
          "pass": true,
          "value": 0,
          "threshold": 0
        },
        {
          "name": "reduced-motion",
          "pass": true,
          "value": 0,
          "threshold": 0
        },
        {
          "name": "color-adherence",
          "pass": true,
          "value": 1,
          "threshold": 0.9
        },
        {
          "name": "font-adherence",
          "pass": true,
          "value": 1,
          "threshold": 0.98
        },
        {
          "name": "radius-adherence",
          "pass": true,
          "value": 1,
          "threshold": 0.85
        }
      ],
      "metrics": {
        "animations": 2,
        "loopingAnimations": 0,
        "svgAnimations": 2,
        "illustrations": 1,
        "lineDrawings": 0,
        "colorAdherence": 1,
        "fontAdherence": 1,
        "radiusAdherence": 1,
        "spacingOnScale": 0.977
      }
    },
    {
      "runId": "20261018-231142",
      "app": "settings",
      "gates": [
        {
          "name": "agent-finished",
          "pass": true,
          "value": 0,
          "threshold": 0
        },
        {
          "name": "build",
          "pass": true,
          "value": true
        },
        {
          "name": "no-console-errors",
          "pass": true,
          "value": 0,
          "threshold": 0
        },
        {
          "name": "no-horizontal-scroll",
          "pass": true,
          "value": 0,
          "threshold": 0
        },
        {
          "name": "accessibility",
          "pass": true,
          "value": 0,
          "threshold": 0
        },
        {
          "name": "reduced-motion",
          "pass": true,
          "value": 0,
          "threshold": 0
        },
        {
          "name": "color-adherence",
          "pass": true,
          "value": 1,
          "threshold": 0.9
        },
        {
          "name": "font-adherence",
          "pass": true,
          "value": 1,
          "threshold": 0.98
        },
        {
          "name": "radius-adherence",
          "pass": true,
          "value": 1,
          "threshold": 0.85
        }
      ],
      "metrics": {
        "animations": 0,
        "loopingAnimations": 0,
        "svgAnimations": 0,
        "illustrations": 0,
        "lineDrawings": 0,
        "colorAdherence": 1,
        "fontAdherence": 1,
        "radiusAdherence": 1,
        "spacingOnScale": 0.982
      }
    }
  ],
  "crossApp": [
    {
      "name": "palette-consistency",
      "pass": true,
      "value": 1,
      "threshold": 0.75
    },
    {
      "name": "type-consistency",
      "pass": true,
      "value": 0.804,
      "threshold": 0.7
    },
    {
      "name": "reference-palette-distance",
      "pass": true,
      "value": 0.18,
      "detail": "mean ΔE2000 from the reference's top colors to the template palette (reported, not gated)"
    },
    {
      "name": "reference-output-palette-distance",
      "pass": true,
      "value": 5.97,
      "detail": "mean ΔE2000 from the reference's top colors to the built apps' top colors (reported)"
    },
    {
      "name": "reference-fontSize-overlap",
      "pass": true,
      "value": 0.937,
      "detail": "share of the built apps' fontSize values within 1px of the reference's main values (reported)"
    },
    {
      "name": "reference-radius-overlap",
      "pass": true,
      "value": 1,
      "detail": "share of the built apps' radius values within 1px of the reference's main values (reported)"
    },
    {
      "name": "reference-spacing-overlap",
      "pass": true,
      "value": 0.947,
      "detail": "share of the built apps' spacing values within 1px of the reference's main values (reported)"
    }
  ],
  "layout": [
    {
      "app": "commerce",
      "runId": "20261018-231142",
      "route": "/",
      "viewport": "desktop",
      "kind": "repeated-drawing",
      "where": "svg [product-image]",
      "detail": "the same drawing appears 2 times on the page"
    },
    {
      "app": "commerce",
      "runId": "20261018-231142",
      "route": "/",
      "viewport": "mobile",
      "kind": "repeated-drawing",
      "where": "svg [product-image]",
      "detail": "the same drawing appears 2 times on the page"
    }
  ],
  "critic": {
    "referenceFidelity": 4,
    "crossAppConsistency": 4,
    "hierarchy": 4,
    "spacingRhythm": 4,
    "componentStates": 4,
    "polish": 4,
    "signature": 3,
    "findings": [
      {
        "severity": "major",
        "area": "signature",
        "summary": "The page close is gone, and with it the dot field, which now appears nowhere in this sample. The blog ends both its home and about pages with a real final call to action, a newsletter form. Published 1.1.0 built that block as the centered two-tone statement over the dot field, with a mono label and pills. Here it is a plain split row: a small 'Subscribe to the newsletter' title on the left and a bare form on the right. The spec caused this: the Applying row now reads 'Page close (optional)' and gives no trigger, and the new intro says 'never adds parts to match the row', so the agent took optional to mean skip it. Dropping the invented closing on the store grid was the right result for the update's goal. Dropping it where the page really ends in an action is a loss against the published version, and the closing statement is a trait of the reference too ('Built for the future. Available today.' centered with its pills at the foot of p1).",
        "samples": 1,
        "of": 1,
        "specCaused": true,
        "evidence": [
          "showcase/runs/graphite-blueprint/1.2.0-rc.1/blog/20261018-231142/screenshots/home-desktop-dark.png",
          "showcase/runs/graphite-blueprint/1.2.0-rc.1/blog/20261018-231142/screenshots/about-desktop-dark.png",
          "showcase/runs/graphite-blueprint/1.1.0-rc.7/blog/20261018-022713/screenshots/home-desktop-dark.png",
          "showcase/runs/graphite-blueprint/1.1.0-rc.7/blog/20261018-022713/screenshots/about-desktop-dark.png",
          "pipeline/linear-study/reference/screenshots/p1-desktop-light.png"
        ],